{
  "schemaVersion": 1,
  "season": {
    "seriesNumber": 6,
    "seriesSlug": "06",
    "seriesName": "Horizon Meets",
    "season": "winter",
    "seasonDisplay": "Зима",
    "startAt": "2026-10-22T21:30:00+07:00",
    "endAt": "2026-10-29T21:30:00+07:00",
    "reportTitle": "Forza Horizon 6: Series 6 «Horizon Meets» — Зима",
    "archiveFile": "seasons/2026-10-22-series-06-winter.md",
    "assetsDirectory": "reports/assets/series-06-winter",
    "fandomUrl": "https://forza.fandom.com/wiki/Category:Series_(FH6)",
    "officialPlaylistUrl": "https://forza.net/fh6playlists",
    "expectedCardCount": 13,
    "expectedDailyItems": 7,
    "maxPublicHtmlBytes": 200000
  },
  "lastContentUpdate": "2026-10-29T07:20:59+07:00",
  "activities": [
    {
      "id": "activity_01_weekly",
      "number": "01",
      "kind": "weekly",
      "title": "Еженедельное испытание: Strictly for Fun",
      "points": "5 очков",
      "conditionHtml": "На 1991 Honda Beat по порядку: владеть и проехать; получить 3 звезды на Danger Signs; припарковаться на любом Car Meet; завершить 2 круга Hokubu Time Attack. Награда по официальной Playlist: 25 000 CR.",
      "howHtml": "Выполняйте главы последовательно. Для прыжков сообщество рекомендует Rollercoaster Leap; на Hokubu достаточно завершить 2 круга.",
      "tuneHtml": "1991 Honda Beat — A, дорожный тюнинг: 757 075 974",
      "sourceHtml": "<a href=\"https://forza.net/fh6playlists\" target=\"_blank\" rel=\"noopener noreferrer\">Forza Playlist</a> · <a href=\"https://www.reddit.com/r/forza/comments/1xcm2gy/fh6_winter_information_thread_series_6/\" target=\"_blank\" rel=\"noopener noreferrer\">Winter Information Thread</a> · <a href=\"https://www.reddit.com/r/ForzaHorizon/comments/1xcimbx/fh6_series_6_winter_breakdown_and_rewards/\" target=\"_blank\" rel=\"noopener noreferrer\">Winter breakdown</a> · <a href=\"https://www.reddit.com/r/ForzaHorizon6/comments/1xcj6zf/fh6_series_6_winter_festival_playlist_guide/\" target=\"_blank\" rel=\"noopener noreferrer\">Winter guide</a>",
      "visual": {
        "image": "activity_01_weekly.png",
        "sourceImage": "network-source-activity_01_weekly.png",
        "orientation": "vertical",
        "typeIconKey": null,
        "sourceUrl": "https://cdn.sanity.io/images/jr6fd40q/production/956631c2dc60307abb71921126ac60636d1b7917-884x1416.png",
        "sourceLabel": "ForzaLabs · Winter 22–29.10.2026: точная полная внутриигровая плитка; исходные CDN-байты сохранены, границы проверены визуально, без ретуши или наложений."
      },
      "completeness": {
        "condition": "confirmed",
        "solution": "community",
        "vehicleTune": "community",
        "visual": "confirmed"
      },
      "missingFields": []
    },
    {
      "id": "activity_02_daily",
      "number": "02",
      "kind": "daily",
      "title": "7 ежедневных заданий",
      "points": "7 × 1 очко",
      "conditionHtml": "<ol><li><strong>22.10:</strong> припаркуйтесь на 7-Eleven Car Meet.</li><li><strong>23.10:</strong> получите не менее 1 звезды на Trailblazers.</li><li><strong>24.10:</strong> завершите Dirt Race.</li><li><strong>25.10:</strong> выполните 5 Air Skills.</li><li><strong>26.10:</strong> выполните 5 Speed Skills.</li><li><strong>27.10:</strong> сфотографируйте любую машину.</li><li><strong>28.10:</strong> потратьте 20 000 CR на улучшения.</li></ol> Награда: 5 000 CR за каждое задание.",
      "howHtml": "7-Eleven Car Meet находится в Nangan рядом с Nangan Day Trip.",
      "tuneHtml": "Тюнинг не требуется.",
      "sourceHtml": "<a href=\"https://forza.net/fh6playlists\" target=\"_blank\" rel=\"noopener noreferrer\">Forza Playlist</a> · <a href=\"https://www.reddit.com/r/forza/comments/1xcm2gy/fh6_winter_information_thread_series_6/\" target=\"_blank\" rel=\"noopener noreferrer\">Winter Information Thread</a>",
      "visual": {
        "image": "",
        "sourceImage": "",
        "orientation": "horizontal",
        "typeIconKey": null,
        "sourceUrl": "",
        "sourceLabel": "Daily: только текст."
      },
      "completeness": {
        "condition": "confirmed",
        "solution": "confirmed",
        "vehicleTune": "not_applicable",
        "visual": "not_applicable"
      },
      "missingFields": []
    },
    {
      "id": "activity_03_photo",
      "number": "03",
      "kind": "photo",
      "title": "#PolarisPoint",
      "points": "2 очка",
      "conditionHtml": "Сфотографируйте любой Polaris в Irokawa Space Center. Награда: All-White Techwear Boots.",
      "howHtml": "Используйте 2021 Polaris RZR Pro XP Factory Racing Limited Edition — награду Touring the Sights; сделайте снимок в Irokawa Space Center.",
      "tuneHtml": "Тюнинг не требуется.",
      "sourceHtml": "<a href=\"https://forza.net/fh6playlists\" target=\"_blank\" rel=\"noopener noreferrer\">Forza Playlist</a> · <a href=\"https://www.reddit.com/r/forza/comments/1xcm2gy/fh6_winter_information_thread_series_6/\" target=\"_blank\" rel=\"noopener noreferrer\">Winter Information Thread</a> · <a href=\"https://www.reddit.com/r/ForzaHorizon/comments/1xcimbx/fh6_series_6_winter_breakdown_and_rewards/\" target=\"_blank\" rel=\"noopener noreferrer\">Winter breakdown</a>",
      "visual": {
        "image": "activity_03_photo.png",
        "sourceImage": "network-source-activity_03_photo.png",
        "orientation": "vertical",
        "typeIconKey": "photo-challenge",
        "sourceUrl": "https://cdn.sanity.io/images/jr6fd40q/production/956bea3b54d45c111048491ba3f070746b2e4070-884x1415.png",
        "sourceLabel": "ForzaLabs · Winter 22–29.10.2026: точная полная внутриигровая плитка #PolarisPoint; оригинальные CDN-байты сохранены, границы 884×1415 проверены визуально, без ретуши и наложений."
      },
      "completeness": {
        "condition": "confirmed",
        "solution": "community",
        "vehicleTune": "not_applicable",
        "visual": "confirmed"
      },
      "missingFields": []
    },
    {
      "id": "activity_04_treasure_hunt",
      "number": "04",
      "kind": "treasure_hunt",
      "title": "Sotoyama Region",
      "points": "3 очка",
      "conditionHtml": "Найдите сундук по фото-подсказке в Sotoyama. Награда: 100 000 CR.",
      "howHtml": "Отправляйтесь к горному озеру к северу от дома Hakusan Mountain Lodge, в восточной части Sotoyama. Сундук находится на восточном берегу; разбейте его машиной.",
      "tuneHtml": "Тюнинг не требуется.",
      "sourceHtml": "<a href=\"https://forza.net/fh6playlists\" target=\"_blank\" rel=\"noopener noreferrer\">Forza Playlist</a> · <a href=\"https://www.reddit.com/r/forza/comments/1xcm2gy/fh6_winter_information_thread_series_6/\" target=\"_blank\" rel=\"noopener noreferrer\">Winter Information Thread</a> · <a href=\"https://www.reddit.com/r/ForzaHorizon/comments/1xcimbx/fh6_series_6_winter_breakdown_and_rewards/\" target=\"_blank\" rel=\"noopener noreferrer\">Winter breakdown</a> · <a href=\"https://traxion.gg/how-to-complete-the-series-6-week-3-sotoyama-region-treasure-hunt-in-forza-horizon-6/\" target=\"_blank\" rel=\"noopener noreferrer\">Sotoyama — Traxion</a> · <a href=\"https://www.pcgamer.com/games/racing/forza-horizon-6-sotoyama-treasure-hunt-location/\" target=\"_blank\" rel=\"noopener noreferrer\">Sotoyama — PC Gamer</a> · <a href=\"https://lights-to-flag.com/fh6-series-6-winter-playlist-20261022/\" target=\"_blank\" rel=\"noopener noreferrer\">Winter — Lights to Flag</a>",
      "visual": {
        "image": "activity_04_treasure_hunt.png",
        "sourceImage": "network-source-activity_04_treasure_hunt.png",
        "orientation": "vertical",
        "typeIconKey": "treasure-hunt",
        "sourceUrl": "https://cdn.sanity.io/images/jr6fd40q/production/18b6c972e8c22c0b12397f98e9bb017de39513f0-886x1412.png",
        "sourceLabel": "ForzaLabs · Winter 22–29.10.2026: точная полная внутриигровая плитка; исходные CDN-байты сохранены, границы проверены визуально, без ретуши или наложений."
      },
      "completeness": {
        "condition": "confirmed",
        "solution": "confirmed",
        "vehicleTune": "not_applicable",
        "visual": "confirmed"
      },
      "missingFields": []
    },
    {
      "id": "activity_05_championship",
      "number": "05",
      "kind": "championship",
      "title": "Touring the Sights",
      "points": "5 очков",
      "conditionHtml": "Road: Super GT, S1 800. Маршруты: Coastline Sprint, Irokawa Circuit, Shimanoyama Sprint. Награда: 2021 Polaris RZR Pro XP Factory Racing Limited Edition.",
      "howHtml": "Победите в чемпионате: наберите больше всего очков по сумме трёх гонок.",
      "tuneHtml": "2017 Ferrari 812 Superfast — S1 800; 855 747 244",
      "sourceHtml": "<a href=\"https://forza.net/fh6playlists\" target=\"_blank\" rel=\"noopener noreferrer\">Forza Playlist</a> · <a href=\"https://www.reddit.com/r/forza/comments/1xcm2gy/fh6_winter_information_thread_series_6/\" target=\"_blank\" rel=\"noopener noreferrer\">Winter Information Thread</a> · <a href=\"https://www.reddit.com/r/ForzaHorizon/comments/1xcimbx/fh6_series_6_winter_breakdown_and_rewards/\" target=\"_blank\" rel=\"noopener noreferrer\">Winter breakdown</a>",
      "visual": {
        "image": "activity_05_championship.png",
        "sourceImage": "network-source-activity_05_championship.png",
        "orientation": "horizontal",
        "typeIconKey": null,
        "sourceUrl": "https://cdn.sanity.io/images/jr6fd40q/production/af633be6dfb2278696951e59c354deeaa4d1df31-886x700.png",
        "sourceLabel": "ForzaLabs · Winter 22–29.10.2026: точная полная внутриигровая плитка; исходные CDN-байты сохранены, границы проверены визуально, без ретуши или наложений."
      },
      "completeness": {
        "condition": "confirmed",
        "solution": "confirmed",
        "vehicleTune": "community",
        "visual": "confirmed"
      },
      "missingFields": []
    },
    {
      "id": "activity_06_championship",
      "number": "06",
      "kind": "championship",
      "title": "Daily Exercise",